Position Title,Agency,Location,Grade,Salary Min,Salary Max,Job Code,Opening Date,Closing Date,Job URL
IT SPECIALIST (SYSADMIN/INFOSEC),Military Treatment Facilities under DHA,"Tripler Army Medical Center, Hawaii",GS,88809,115458,2210,2026-05-11,2026-05-20,https://www.usajobs.gov:443/job/866877200
Supervisory IT Specialist (Network/System Analysis),Military Treatment Facilities under DHA,"West Point, New York",GS,125431,163062,2210,2026-05-07,2026-05-13,https://www.usajobs.gov:443/job/867910200
Supervisory IT Cybersecurity Specialist,National Gallery of Art,"Washington, District of Columbia",SL,203134,228000,2210,2026-05-01,2026-05-15,https://www.usajobs.gov:443/job/867474900
Information Technology Specialist (DATAMGT),National Institutes of Health,"Baltimore, Maryland",GS,85447,158322,2210,2026-05-11,2026-05-15,https://www.usajobs.gov:443/job/868082900
IT Specialist,National Oceanic and Atmospheric Administration,"College Park, Maryland",GS,121785,158322,2210,2026-05-01,2026-05-14,https://www.usajobs.gov:443/job/867371200
IT Specialist,National Oceanic and Atmospheric Administration,"College Park, Maryland",GS,121785,158322,2210,2026-05-01,2026-05-14,https://www.usajobs.gov:443/job/867372400
Chief Information Officer,National Telecommunications and Information Administration,"Washington, District of Columbia",ES,151661,228000,2210,2026-04-29,2026-05-13,https://www.usajobs.gov:443/job/866934800
INFORMATION TECHNOLOGY SPECIALIST (APPSW),Naval Air Systems Command,"Cherry Point, North Carolina",GS,89508,116362,2210,2026-05-12,2026-05-18,https://www.usajobs.gov:443/job/868104900
IT CYBERSECURITY SPECIALIST (INFOSEC),Naval Air Systems Command,"Naval Air Station Jacksonville, Florida",DS,89508,140426,2210,2026-02-11,2027-02-10,https://www.usajobs.gov:443/job/857151400
IT SPECIALIST (INFOSEC),Naval Air Systems Command,"Cherry Point, North Carolina",GS,89508,116362,2210,2026-05-08,2026-05-12,https://www.usajobs.gov:443/job/867875000
IT SPECIALIST (SYSADMIN),Naval Education and Training Command,"El Segundo, California",GS,71957,93549,2210,2026-05-08,2026-05-12,https://www.usajobs.gov:443/job/867649100
INFORMATION TECHNOLOGY SPECIALIST (PLCYPLN/INFOSEC),Naval Facilities Engineering Systems Command,"Washington Navy Yard, District of Columbia",GS,143913,187093,2210,2026-05-11,2026-05-18,https://www.usajobs.gov:443/job/868167600
IT SPECIALIST (SYSADMIN/NETWORK),Naval Facilities Engineering Systems Command,"Honolulu, Hawaii",GS,123543,160611,2210,2026-05-08,2026-05-14,https://www.usajobs.gov:443/job/868249300
SUPERVISORY INFORMATION TECHNOLOGY SPECIALIST (PLCYPLN),Naval Facilities Engineering Systems Command,"Naval Station Complex, San Diego, California",GS,121585,158062,2210,2026-05-06,2026-05-15,https://www.usajobs.gov:443/job/867990700
IT Specialist (OS),Naval Intelligence Activity,"National Maritime Intelligence Center, Maryland",GG,121785,158322,2210,2026-05-06,2026-05-12,https://www.usajobs.gov:443/job/867968500
IT SPECIALIST (ENTARCH),Naval Sea Systems Command,"Naval Support Activity, Mechanicsburg, Pennsylvania",GS,108592,141171,2210,2026-05-04,2026-05-13,https://www.usajobs.gov:443/job/867748500
SUPV IT SPECIALIST (INFOSEC),Naval Sea Systems Command,"Washington Navy Yard, District of Columbia",NH,143913,197200,2210,2026-05-08,2026-05-18,https://www.usajobs.gov:443/job/868257000
IT SPECIALIST (INFOSEC),Naval Special Warfare Command,"Little Creek Amphibious Base, Virginia",GS,75788,118092,2210,2026-04-29,2026-05-12,https://www.usajobs.gov:443/job/866887000
IT Project Manager,Nuclear Regulatory Commission,"Rockville, Maryland",GG,143913,187093,2210,2026-05-05,2026-05-19,https://www.usajobs.gov:443/job/867865400
IT Specialist (SysAnalysis),Nuclear Regulatory Commission,"Rockville, Maryland",GG,121785,158322,2210,2026-05-05,2026-05-19,https://www.usajobs.gov:443/job/867865600
"Supervisory Information Technology Specialist, GS-2210-15 FPL 15 (Direct Hire)",Office of Finance and Operations,"Washington, District of Columbia",GS,169279,197200,2210,2026-05-05,2026-05-14,https://www.usajobs.gov:443/job/867877600
IT Specialist (INFOSEC/ENTARCH),Office of Inspector General,"Washington, District of Columbia",GS,143913,187093,2210,2026-04-30,2026-05-13,https://www.usajobs.gov:443/job/867245400
IT Specialist,Office of Personnel Management,"San Diego, California",GS,61722,111966,2210,2026-04-22,2026-05-21,https://www.usajobs.gov:443/job/866249900
IT Service Delivery & Operations Lead,Office of the Assistant Secretary for Administration and Management,"Washington, District of Columbia",GS,143913,187093,2210,2026-05-07,2026-05-20,https://www.usajobs.gov:443/job/868104200
Data Trust & Safety Division Director,Office of the Chief Information Officer,"Washington, District of Columbia",GS,169279,197200,2210,2026-05-06,2026-05-15,https://www.usajobs.gov:443/job/868053500
Lead_Portfolio Management,Office of the Director of National Intelligence,"Bethesda, Maryland",GS,155797,197200,2210,2026-05-06,2026-05-21,https://www.usajobs.gov:443/job/868159900
Lead_Portfolio Management,Office of the Director of National Intelligence,"Bethesda, Maryland",GS,173146,197200,2210,2026-05-06,2026-05-21,https://www.usajobs.gov:443/job/868163900
Senior Strategy and Governance Advisor,Office of the Secretary of Transportation,"Washington, District of Columbia",SL,151661,228000,2210,2026-04-29,2026-05-12,https://www.usajobs.gov:443/job/867115500
Information Technology Project Manager,Patent and Trademark Office,"Alexandria, Virginia",GS,149913,187093,2210,2026-04-29,2026-05-13,https://www.usajobs.gov:443/job/867138100
Information Technology Project Manager,Patent and Trademark Office,"Alexandria, Virginia",GS,149913,187093,2210,2026-04-29,2026-05-13,https://www.usajobs.gov:443/job/867141800
Supervisory Information Technology Specialist,Patent and Trademark Office,"Alexandria, Virginia",GS,169279,197200,2210,2026-04-29,2026-05-13,https://www.usajobs.gov:443/job/867128500
IT Specialist (Customer Service),Postal Regulatory Commission,"Washington, District of Columbia",ZY,102415,158322,2210,2026-05-01,2026-05-15,https://www.usajobs.gov:443/job/867566800
Senior Software Developer,Railroad Retirement Board,"Anywhere in the U.S. (remote job), United States",GS,90925,118204,2210,2026-04-30,2026-05-14,https://www.usajobs.gov:443/job/867462000
Senior Software Developer,Railroad Retirement Board,"Anywhere in the U.S. (remote job), United States",GS,90925,118204,2210,2026-04-30,2026-05-14,https://www.usajobs.gov:443/job/867462100
INFORMATION TECHNOLOGY SPECIALIST (SYSANALYSIS),STRATEGIC SYSTEMS PROGRAMS (SSP),"Washington Navy Yard, District of Columbia",NH,102415,158322,2210,2026-05-07,2026-05-13,https://www.usajobs.gov:443/job/868216200
INFORMATION TECHNOLOGY SPECIALIST (SYSANALYSIS),STRATEGIC SYSTEMS PROGRAMS (SSP),"Washington Navy Yard, District of Columbia",NH,143913,197200,2210,2026-05-07,2026-05-13,https://www.usajobs.gov:443/job/868232100
INFORMATION TECHNOLOGY SPECIALIST (INFOSEC),Secretary of the Navy Offices (SECNAV),"New London County, Connecticut",GS,84260,131293,2210,2026-05-06,2026-05-12,https://www.usajobs.gov:443/job/868052900
BRANCH CHIEF - END USER TECHNOLOGY,Securities and Exchange Commission,"Washington, District of Columbia",SK,162308,280156,2210,2026-05-01,2026-05-15,https://www.usajobs.gov:443/job/867554100
IT SPECIALIST - EXECUTIVE SUPPORT,Securities and Exchange Commission,"Washington, District of Columbia",SK,112132,189985,2210,2026-04-28,2026-05-12,https://www.usajobs.gov:443/job/866915800
SUPERVISORY IT SPECIALIST - END USER SERVICES,Securities and Exchange Commission,"Washington, District of Columbia",SK,162308,280156,2210,2026-04-30,2026-05-14,https://www.usajobs.gov:443/job/867338900
Cybersecurity Senior Specialist #5387,Senate,"Washington, District of Columbia",AD,102745,173959,2210,2026-04-22,2026-05-13,https://www.usajobs.gov:443/job/866328600
Principal Network Engineer (Unified Communications/Voice) #332,Senate,"Washington, District of Columbia",AD,130469,181570,2210,2026-05-06,2026-05-20,https://www.usajobs.gov:443/job/868204800
Business Intelligence Platform Developer,Social Security Administration,"Woodlawn, Maryland",GS,143913,197200,2210,2026-03-04,2026-08-31,https://www.usajobs.gov:443/job/859667400
Business Intelligence Platform Developer,Social Security Administration,"Woodlawn, Maryland",GS,121785,158322,2210,2026-03-04,2026-08-31,https://www.usajobs.gov:443/job/859667500
Business Systems Developer,Social Security Administration,"Woodlawn, Maryland",GS,121785,197200,2210,2026-01-26,2026-07-24,https://www.usajobs.gov:443/job/855342800
COBOL Developer,Social Security Administration,"Woodlawn, Maryland",GS,143913,197200,2210,2026-03-05,2026-09-03,https://www.usajobs.gov:443/job/859750900
Cloud Systems Administrator,Social Security Administration,"Woodlawn, Maryland",GS,121785,158322,2210,2026-03-06,2026-09-04,https://www.usajobs.gov:443/job/860057400
Cloud/Infrastructure Engineer - DHA,Social Security Administration,"Woodlawn, Maryland",GS,107446,139684,2210,2026-03-09,2026-09-04,https://www.usajobs.gov:443/job/860257100
Cloud/Infrastructure Technician - DHA,Social Security Administration,"Woodlawn, Maryland",GS,90925,118204,2210,2026-03-09,2026-09-04,https://www.usajobs.gov:443/job/860229600
Data Scientist,Social Security Administration,"Woodlawn, Maryland",GS,143913,187093,2210,2026-02-06,2026-08-05,https://www.usajobs.gov:443/job/856629100
Data Solutions Developer,Social Security Administration,"Woodlawn, Maryland",GS,143913,187093,2210,2026-03-05,2026-09-03,https://www.usajobs.gov:443/job/859907200
Data Solutions Developer-DHA,Social Security Administration,"Woodlawn, Maryland",GS,121785,158322,2210,2026-03-05,2026-09-03,https://www.usajobs.gov:443/job/859884600
Database Administrator-DHA,Social Security Administration,"Denver, Colorado",GS,107446,139684,2210,2026-03-09,2026-09-04,https://www.usajobs.gov:443/job/860230400
HIT Integration Developer,Social Security Administration,"Woodlawn, Maryland",GS,143913,197200,2210,2026-02-06,2026-08-05,https://www.usajobs.gov:443/job/856720800
IT Specialist (APPSW) - .NET - DHA,Social Security Administration,"Denver, Colorado",GS,90925,139684,2210,2026-04-15,2026-10-12,https://www.usajobs.gov:443/job/865188800
IT Specialist (Enterprise Data Architect) - DHA,Social Security Administration,"Woodlawn, Maryland",GS,143913,187093,2210,2026-04-15,2026-10-12,https://www.usajobs.gov:443/job/865155700
IT Specialist (SysAdmin) - DHA,Social Security Administration,"Woodlawn, Maryland",GS,121785,158322,2210,2026-03-16,2026-09-11,https://www.usajobs.gov:443/job/861218500
Infrastructure Engineer - DHA,Social Security Administration,"Woodlawn, Maryland",GS,121785,158322,2210,2026-03-09,2026-09-04,https://www.usajobs.gov:443/job/860240500
JAVA Angular Full Stack Web Application Developer,Social Security Administration,"Woodlawn, Maryland",GS,121785,197200,2210,2026-01-26,2026-07-24,https://www.usajobs.gov:443/job/855330700
Kafka Engineer,Social Security Administration,"Woodlawn, Maryland",GS,143913,197200,2210,2026-02-05,2026-08-04,https://www.usajobs.gov:443/job/856552100
Mainframe Storage Architect,Social Security Administration,"Denver, Colorado",GS,126384,164301,2210,2026-03-05,2026-09-03,https://www.usajobs.gov:443/job/859910100
Mainframe Storage Engineer -- DHA,Social Security Administration,"Denver, Colorado",GS,107446,139684,2210,2026-03-09,2026-09-04,https://www.usajobs.gov:443/job/860200700
Mainframe/CICS Architect,Social Security Administration,"Woodlawn, Maryland",GS,169279,197200,2210,2026-03-05,2026-09-03,https://www.usajobs.gov:443/job/859910400
Mainframe/CICS Engineer -- DHA,Social Security Administration,"Woodlawn, Maryland",GS,143913,187093,2210,2026-03-09,2026-09-04,https://www.usajobs.gov:443/job/860215700
Network Architect-DHA,Social Security Administration,"Denver, Colorado",GS,126384,164301,2210,2026-03-06,2026-09-02,https://www.usajobs.gov:443/job/860040900
Network Engineer--DHA,Social Security Administration,"Denver, Colorado",GS,107446,139684,2210,2026-03-09,2026-09-04,https://www.usajobs.gov:443/job/860176400
Node-React Full Stack Web Application Developer,Social Security Administration,"Woodlawn, Maryland",GS,121785,197200,2210,2026-01-26,2026-07-24,https://www.usajobs.gov:443/job/855341900
Node-React Full Stack Web Application Developer - DHA,Social Security Administration,"Woodlawn, Maryland",GS,102415,133142,2210,2026-04-15,2026-10-12,https://www.usajobs.gov:443/job/865142100
Open Systems Storage Engineer-DHA,Social Security Administration,"Denver, Colorado",GS,107446,139684,2210,2026-03-06,2026-09-04,https://www.usajobs.gov:443/job/860062700
PEGA Developer- DHA,Social Security Administration,"Woodlawn, Maryland",GS,143913,197200,2210,2026-04-16,2026-10-13,https://www.usajobs.gov:443/job/865420200
Product Manager / Senior Product Manager,Social Security Administration,"Woodlawn, Maryland",GS,143913,197200,2210,2026-04-16,2026-10-13,https://www.usajobs.gov:443/job/865315600
Python Developer,Social Security Administration,"Woodlawn, Maryland",GS,143913,197200,2210,2026-02-06,2026-08-05,https://www.usajobs.gov:443/job/856726500
ServiceNow Architect,Social Security Administration,"Denver, Colorado",GS,126384,164301,2210,2026-03-09,2026-09-04,https://www.usajobs.gov:443/job/860204700
ServiceNow Engineer-DHA,Social Security Administration,"Denver, Colorado",GS,107446,139684,2210,2026-03-06,2026-09-04,https://www.usajobs.gov:443/job/860065800
Solutions Architect,Social Security Administration,"Woodlawn, Maryland",GS,143913,197200,2210,2026-02-06,2026-08-05,https://www.usajobs.gov:443/job/856787000
Test Automation Engineer,Social Security Administration,"Woodlawn, Maryland",GS,143913,197200,2210,2026-02-06,2026-08-05,https://www.usajobs.gov:443/job/856707700
UX Practitioner - DHA,Social Security Administration,"Woodlawn, Maryland",GS,102415,158322,2210,2026-03-09,2026-09-04,https://www.usajobs.gov:443/job/860168700
Information Technology Specialist (INFOSEC),Substance Abuse and Mental Health Services Administration,"Rockville, Maryland",GS,169279,197200,2210,2026-05-08,2026-05-13,https://www.usajobs.gov:443/job/868200300
Lead Cloud Security Engineer (Information Security),Technology Transformation Service,"Washington, District of Columbia",GS,169279,197200,2210,2026-05-04,2026-05-18,https://www.usajobs.gov:443/job/867607100
IT Specialist (AI),"Treasury, Departmental Offices","Salt Lake City, Utah",GS,89508,197200,2210,2026-02-24,2026-07-20,https://www.usajobs.gov:443/job/858700600
INFORMATION TECHNOLOGY SPECIALIST (NETWORK SERVICES/CUSTSPT),U.S. Air Force Academy,"Air Force Academy, Colorado",GS,63351,82362,2210,2026-05-05,2026-05-12,https://www.usajobs.gov:443/job/867435300
IT Specialist,U.S. Army Corps of Engineers,"Jacksonville, Florida",GS,61722,97087,2210,2026-05-01,2026-05-18,https://www.usajobs.gov:443/job/867377500
IT Specialist (Applications Software),U.S. Census Bureau,"Suitland, Maryland",GG,121785,158322,2210,2026-05-07,2026-05-21,https://www.usajobs.gov:443/job/868269100
Courtroom Technology Specialist,U.S. Courts,"Richmond, Virginia",CL,56797,92307,2210,2026-02-13,2027-02-12,https://www.usajobs.gov:443/job/857711200
IT Security Administrator,U.S. Courts,"Clarksburg, West Virginia",CL,71583,133178,2210,2026-03-09,2026-05-31,https://www.usajobs.gov:443/job/860457500
IT Support Specialist I,U.S. Courts,"New Orleans, Louisiana",CL,59732,97098,2210,2026-04-06,2027-04-02,https://www.usajobs.gov:443/job/864099500
Information Technology Technician II 6 Month Term,U.S. Courts,"Norfolk, Virginia",CL,45365,56713,2210,2026-03-30,2026-06-30,https://www.usajobs.gov:443/job/863077600
Senior IT Specialist (Web Development),U.S. Courts,"Brooklyn, New York",CL,70392,114425,2210,2026-05-01,2027-04-30,https://www.usajobs.gov:443/job/867635600
System Engineer,U.S. Courts,"Washington, District of Columbia",CL,81117,156792,2210,2025-12-23,2026-12-22,https://www.usajobs.gov:443/job/853173000
Systems Administrator / IT Security Officer,U.S. Courts,"Brooklyn, New York",CL,84358,137165,2210,2026-05-01,2027-04-30,https://www.usajobs.gov:443/job/867635200
Systems and Network Administrator,U.S. Courts,"Washington, District of Columbia",CL,81906,133178,2210,2026-03-26,2026-06-26,https://www.usajobs.gov:443/job/862780000
Temporary Information Technology Technician II  1 Year Term,U.S. Courts,"Alexandria, Virginia",CL,56478,70623,2210,2026-04-15,2027-04-14,https://www.usajobs.gov:443/job/865610500
IT Specialist (APPSW/CUSTSPT),U.S. International Trade Commission,"Washington, District of Columbia",GS,169279,197200,2210,2026-04-29,2026-05-12,https://www.usajobs.gov:443/job/867217200
IT Specialist (Artificial Intelligence) DIRECT HIRE,U.S. International Trade Commission,"Washington, District of Columbia",GS,169279,197200,2210,2026-04-29,2026-05-12,https://www.usajobs.gov:443/job/867167800
Business Analyst - Financial Systems,U.S. Marine Corps,"Quantico, Virginia",NF,85000,100000,2210,2026-05-05,2026-06-02,https://www.usajobs.gov:443/job/868009700
INFORMATION TECHNOLOGY SPECIALIST (ENTARCH),U.S. Marine Corps,"Fort Meade, Maryland",GG,130536,178402,2210,2025-12-31,2026-06-29,https://www.usajobs.gov:443/job/853454000
INFORMATION TECHNOLOGY SPECIALIST (ENTARCH),U.S. Marine Corps,"Fort Meade, Maryland",GG,130536,178402,2210,2026-01-05,2026-07-03,https://www.usajobs.gov:443/job/853544900
INFORMATION TECHNOLOGY SPECIALIST (PLCYPLN),U.S. Marine Corps,"Camp H.M. Smith Marine Corp Base, Hawaii",GS,111119,144457,2210,2026-05-07,2026-05-12,https://www.usajobs.gov:443/job/868131000
IT CYBERSECURITY SPECIALIST (INFOSEC),U.S. Marine Corps,"Fort Meade, Maryland",GS,131841,180186,2210,2026-05-06,2026-05-22,https://www.usajobs.gov:443/job/868232400
IT CYBERSECURITY SPECIALIST (NETWORK),U.S. Marine Corps,"Fort Meade, Maryland",GS,121785,158322,2210,2026-05-05,2026-05-25,https://www.usajobs.gov:443/job/867948100
IT CYBERSECURITY SPECIALIST (SYSADMIN),U.S. Marine Corps,"Fort Meade, Maryland",GG,114695,156753,2210,2026-05-06,2026-05-21,https://www.usajobs.gov:443/job/868043900
IT SPECIALIST (NETWORK),U.S. Marine Corps,"Twentynine Palms, California",GS,87061,113185,2210,2026-04-30,2026-06-01,https://www.usajobs.gov:443/job/867286200
IT SPECIALIST (SYSANALYSIS),U.S. Marine Corps,"Fort Meade, Maryland",NH,102415,158322,2210,2026-04-06,2026-06-08,https://www.usajobs.gov:443/job/863963300
LEAD INFORMATION TECHNOLOGY SPECIALIST (SYSANALYSIS/INFOSEC),U.S. Marine Corps,"Stafford, Virginia",NH,143913,197200,2210,2026-04-29,2026-06-29,https://www.usajobs.gov:443/job/867265400
Project Manager (CXD),U.S. Marine Corps,"Quantico, Virginia",NF,105000,120000,2210,2026-05-07,2026-05-28,https://www.usajobs.gov:443/job/868287500
Senior Enterprise Data Architect,U.S. Marine Corps,"Quantico, Virginia",NF,130000,150000,2210,2026-04-23,2026-05-21,https://www.usajobs.gov:443/job/866484300
IT SPECIALIST (SYSADMIN),U.S. Pacific Fleet,"Bremerton, Washington",GS,69373,109122,2210,2026-05-04,2026-05-13,https://www.usajobs.gov:443/job/867602500
SUPERVISORY IT SPECIALIST (NETWORK),U.S. Pacific Fleet,"Pearl Harbor, Hawaii",GS,111119,144457,2210,2026-05-08,2026-05-19,https://www.usajobs.gov:443/job/868177200
Forensic Computer Analyst,U.S. Postal Service,"Atlanta, Georgia",WE,78160,144820,2210,2026-05-07,2026-06-06,https://www.usajobs.gov:443/job/868250600
Forensic Computer Analyst,U.S. Postal Service,"Denver, Colorado",WE,78160,144820,2210,2026-05-07,2026-06-06,https://www.usajobs.gov:443/job/868250000
IT Cybersecurity Specialist,U.S. Tax Court,"Washington, District of Columbia",GS,121785,187093,2210,2026-04-16,2026-05-15,https://www.usajobs.gov:443/job/865515400
SUPERVISORY IT SPECIALIST (SYS ADMIN),United States Fleet Forces Command,"Kittery, Maine",GS,120548,156715,2210,2026-05-05,2026-05-20,https://www.usajobs.gov:443/job/867877500
